{
  "$schema": "https://json-schema.org/draft/2020-12/schema",
  "title": "SeqDoc canonical work state",
  "type": "object",
  "required": ["schemaVersion", "id", "kind", "title", "owner", "track", "lifecycle", "dependencies", "contractRevision", "baseline", "checkpointId", "checkpointPath", "branch", "pr", "selectedForExecution", "nextAction", "expectedGithubState", "lifecycleLabel", "statusReason"],
  "properties": {
    "schemaVersion": {"const": 1},
    "id": {"type": "string", "pattern": "^(GH-[0-9]+|[A-Za-z][A-Za-z0-9-]*)$"},
    "kind": {"enum": ["github-issue", "parent", "acceptance", "synthetic"]},
    "number": {"type": "integer", "minimum": 1},
    "sourceUrl": {"type": "string", "format": "uri"},
    "title": {"type": "string", "minLength": 1},
    "owner": {"type": "string", "minLength": 1},
    "track": {"type": "string", "minLength": 1},
    "lifecycle": {"enum": ["Draft", "Blocked", "Ready", "Active", "ReviewRequired", "ResolvingFindings", "Verifying", "Closed", "Cancelled"]},
    "dependencies": {"type": "array", "items": {"type": "string"}, "uniqueItems": true},
    "contractRevision": {"type": ["string", "null"]},
    "baseline": {"type": ["string", "null"], "pattern": "^[0-9a-f]{40}$"},
    "checkpointId": {"type": ["string", "null"]},
    "checkpointPath": {"type": ["string", "null"]},
    "branch": {"type": ["string", "null"]},
    "pr": {"type": ["string", "null"]},
    "selectedForExecution": {"type": "boolean"},
    "nextAction": {"type": ["string", "null"]},
    "expectedGithubState": {"enum": ["OPEN", "CLOSED", "NONE"]},
    "lifecycleLabel": {"type": ["string", "null"]},
    "statusReason": {"type": "string", "minLength": 1}
  },
  "additionalProperties": false
}
