{
  "baseline": null,
  "branch": null,
  "checkpointId": null,
  "checkpointPath": null,
  "contractRevision": "https://github.com/Bilaltariq41/SeqDoc/issues/76",
  "dependencies": [
    "GH-13",
    "GH-17",
    "GH-18",
    "GH-53"
  ],
  "expectedGithubState": "OPEN",
  "id": "GH-76",
  "kind": "github-issue",
  "lifecycle": "Blocked",
  "lifecycleLabel": "blocked",
  "nextAction": null,
  "number": 76,
  "owner": "qais",
  "pr": null,
  "schemaVersion": 1,
  "selectedForExecution": false,
  "sourceUrl": "https://github.com/Bilaltariq41/SeqDoc/issues/76",
  "statusReason": "Blocked pending PR #68 publication and prerequisite readiness evidence.",
  "title": "[Services] Inventory residual service and outbound gaps",
  "track": "services"
}
