{
  "baseline": null,
  "branch": null,
  "checkpointId": null,
  "checkpointPath": null,
  "contractRevision": "https://github.com/Bilaltariq41/SeqDoc/issues/41",
  "dependencies": [],
  "expectedGithubState": "CLOSED",
  "id": "GH-41",
  "kind": "github-issue",
  "lifecycle": "Closed",
  "lifecycleLabel": null,
  "nextAction": null,
  "number": 41,
  "owner": "qais",
  "pr": null,
  "schemaVersion": 1,
  "selectedForExecution": false,
  "sourceUrl": "https://github.com/Bilaltariq41/SeqDoc/issues/41",
  "statusReason": "Completed and merged.",
  "title": "[Services] Admit measured classic-WCF net9 compatibility tuples",
  "track": "services"
}
