{
  "baseline": null,
  "branch": null,
  "checkpointId": null,
  "checkpointPath": null,
  "contractRevision": "https://github.com/Bilaltariq41/SeqDoc/issues/80",
  "dependencies": [
    "GH-13",
    "GH-17",
    "GH-18",
    "GH-53"
  ],
  "expectedGithubState": "OPEN",
  "id": "GH-80",
  "kind": "github-issue",
  "lifecycle": "Blocked",
  "lifecycleLabel": "blocked",
  "nextAction": null,
  "number": 80,
  "owner": "unassigned",
  "pr": null,
  "schemaVersion": 1,
  "selectedForExecution": false,
  "sourceUrl": "https://github.com/Bilaltariq41/SeqDoc/issues/80",
  "statusReason": "Unassigned planning/readiness work; blocked pending PR #68 publication and prerequisite evidence.",
  "title": "[Outcomes] Inventory result, error, and exception gaps",
  "track": "outcomes"
}
