{
  "baseline": "ca5bc4b3be0f3ea97def06f053f7bbd1f7a40d2e",
  "branch": null,
  "checkpointId": null,
  "checkpointPath": null,
  "contractRevision": "https://github.com/Bilaltariq41/SeqDoc/issues/16#issuecomment-5468732437",
  "dependencies": [
    "GH-14",
    "GH-15"
  ],
  "expectedGithubState": "OPEN",
  "id": "GH-16",
  "kind": "github-issue",
  "lifecycle": "ReviewRequired",
  "lifecycleLabel": "review-required",
  "nextAction": null,
  "number": 16,
  "owner": "abood",
  "pr": "https://github.com/Bilaltariq41/SeqDoc/pull/48",
  "schemaVersion": 1,
  "selectedForExecution": false,
  "sourceUrl": "https://github.com/Bilaltariq41/SeqDoc/issues/16",
  "statusReason": "Review-ready external PR; no local capsule exists.",
  "title": "[Workers] Polling batch retry and cancellation presentation",
  "track": "workers"
}
