{
  "baseline": null,
  "branch": null,
  "checkpointId": "QFIX1",
  "checkpointPath": "docs/work/quality/QFIX1",
  "contractRevision": "docs/work/quality/QFIX1/checkpoint.md",
  "dependencies": [],
  "expectedGithubState": "NONE",
  "id": "QFIX1",
  "kind": "synthetic",
  "lifecycle": "Closed",
  "lifecycleLabel": null,
  "nextAction": "Owner-authorized publication batch.",
  "owner": "maintainer",
  "pr": null,
  "schemaVersion": 1,
  "selectedForExecution": false,
  "statusReason": "Owner-authorized mechanical repair to publish the two missing package locks and prove their existing CLI consumers without product or test changes.",
  "title": "QFIX1 package lock publication",
  "track": "quality"
}
