{
  "baseline": "aec7cade98dcfe55e9e2b8eadf9c0d42055254ff",
  "branch": "issue-54-outbound-http-boundaries",
  "checkpointId": "QHTTP-A",
  "checkpointPath": "docs/work/outbound-http/QHTTP-A",
  "contractRevision": "https://github.com/Bilaltariq41/SeqDoc/issues/54#issuecomment-5509514090",
  "dependencies": [],
  "expectedGithubState": "OPEN",
  "id": "GH-54",
  "kind": "github-issue",
  "lifecycle": "Active",
  "lifecycleLabel": "active",
  "nextAction": "Run the declared QHTTP-A final gate in docs/work/outbound-http/QHTTP-A/checkpoint.md; do not reuse the historical final-gate evidence.",
  "number": 54,
  "owner": "qais",
  "pr": "https://github.com/Bilaltariq41/SeqDoc/pull/59",
  "schemaVersion": 1,
  "selectedForExecution": false,
  "sourceUrl": "https://github.com/Bilaltariq41/SeqDoc/issues/54",
  "statusReason": "QHTTP-A-F1..F3 are dispositioned after one independent review; the Analysis OutboundHttp focused lane passes 7/7. State is Verifying and the declared final gate is pending; historical contributor review/final-gate evidence remains non-authoritative and is not reused.",
  "title": "[Outbound HTTP] Exact direct HttpClient GET/POST request boundaries",
  "track": "services"
}
