{
  "baseline": null,
  "branch": null,
  "checkpointId": null,
  "checkpointPath": null,
  "contractRevision": "https://github.com/Bilaltariq41/SeqDoc/issues/73",
  "dependencies": [
    "GH-72"
  ],
  "expectedGithubState": "OPEN",
  "id": "GH-73",
  "kind": "github-issue",
  "lifecycle": "Blocked",
  "lifecycleLabel": "blocked",
  "nextAction": null,
  "number": 73,
  "owner": "unassigned",
  "pr": null,
  "schemaVersion": 1,
  "selectedForExecution": false,
  "sourceUrl": "https://github.com/Bilaltariq41/SeqDoc/issues/73",
  "statusReason": "Unassigned planning/readiness work; blocked by GH-72 and pending PR #68 publication.",
  "title": "[Quality] Define compatibility and resource measurement protocol",
  "track": "quality"
}
