{
  "baseline": null,
  "branch": null,
  "checkpointId": null,
  "checkpointPath": null,
  "contractRevision": "https://github.com/Bilaltariq41/SeqDoc/issues/14",
  "dependencies": [],
  "expectedGithubState": "CLOSED",
  "id": "GH-14",
  "kind": "github-issue",
  "lifecycle": "Closed",
  "lifecycleLabel": null,
  "nextAction": null,
  "number": 14,
  "owner": "abood",
  "pr": null,
  "schemaVersion": 1,
  "selectedForExecution": false,
  "sourceUrl": "https://github.com/Bilaltariq41/SeqDoc/issues/14",
  "statusReason": "Completed and merged.",
  "title": "[Workers] Hosted worker lifecycle roots",
  "track": "workers"
}
