{
  "baseline": null,
  "branch": null,
  "checkpointId": null,
  "checkpointPath": null,
  "contractRevision": "https://github.com/Bilaltariq41/SeqDoc/issues/3",
  "dependencies": [],
  "expectedGithubState": "OPEN",
  "id": "GH-3",
  "kind": "parent",
  "lifecycle": "Active",
  "lifecycleLabel": "active",
  "nextAction": null,
  "number": 3,
  "owner": "ahmad",
  "pr": null,
  "schemaVersion": 1,
  "selectedForExecution": false,
  "sourceUrl": "https://github.com/Bilaltariq41/SeqDoc/issues/3",
  "statusReason": "Parent workstream remains active while open children progress.",
  "title": "[Workstream] Persistence and state semantics",
  "track": "persistence"
}
