{
  "baseline": null,
  "branch": null,
  "checkpointId": null,
  "checkpointPath": null,
  "contractRevision": "https://github.com/Bilaltariq41/SeqDoc/issues/21",
  "dependencies": [],
  "expectedGithubState": "CLOSED",
  "id": "GH-21",
  "kind": "acceptance",
  "lifecycle": "Closed",
  "lifecycleLabel": null,
  "nextAction": null,
  "number": 21,
  "owner": "maintainer",
  "pr": null,
  "schemaVersion": 1,
  "selectedForExecution": false,
  "sourceUrl": "https://github.com/Bilaltariq41/SeqDoc/issues/21",
  "statusReason": "Acceptance completed.",
  "title": "[Traversal] Large-diagram supplied-project acceptance",
  "track": "traversal"
}
