{
  "baseline": null,
  "branch": null,
  "checkpointId": null,
  "checkpointPath": null,
  "contractRevision": "https://github.com/Bilaltariq41/SeqDoc/issues/2",
  "dependencies": [],
  "expectedGithubState": "CLOSED",
  "id": "GH-2",
  "kind": "parent",
  "lifecycle": "Closed",
  "lifecycleLabel": null,
  "nextAction": null,
  "number": 2,
  "owner": "maintainer",
  "pr": null,
  "schemaVersion": 1,
  "selectedForExecution": false,
  "sourceUrl": "https://github.com/Bilaltariq41/SeqDoc/issues/2",
  "statusReason": "Merged workstream.",
  "title": "[Workstream] Depthless traversal and large diagrams",
  "track": "traversal"
}
