{
  "baseline": "ca5bc4b3be0f3ea97def06f053f7bbd1f7a40d2e",
  "branch": "feature/issue-12-persisted-transitions",
  "checkpointId": "I12",
  "checkpointPath": "docs/work/persistence/I12",
  "contractRevision": "https://github.com/Bilaltariq41/SeqDoc/issues/12#issuecomment-5485875430",
  "dependencies": [
    "GH-9",
    "GH-10"
  ],
  "expectedGithubState": "CLOSED",
  "id": "GH-12",
  "kind": "github-issue",
  "lifecycle": "Closed",
  "lifecycleLabel": null,
  "nextAction": null,
  "number": 12,
  "owner": "ahmad",
  "pr": "https://github.com/Bilaltariq41/SeqDoc/pull/51",
  "schemaVersion": 1,
  "selectedForExecution": false,
  "sourceUrl": "https://github.com/Bilaltariq41/SeqDoc/issues/12",
  "statusReason": "PR #51 merged as e145f3c3a5a872ea4369142d2d652ff018a1c0d0 with Ahmad Krarha's commits and attribution preserved. One independent review ran; all findings and the final fixture regression were resolved under explicit owner authorization. Focused verification and the authorized final gate established no Issue #12 regression; remaining Analysis and Acceptance failures matched documented baseline or environment signatures.",
  "title": "[Persistence] Persisted state transitions and caller outcomes",
  "track": "persistence"
}
